"Year","Paper","Location","Sentence"
2014,"p361","Abstract","Our results show that heatmaps were mainly used to detect hot spots while the cluster representations proved useful to compare variables, allowing the players to uncover relationships between them and in turn allowing a deeper insight into the gameplay data."
2010,"p723-li","Abstract","Overall, we found that ActionShot’s history features provide value beyond typical browser history interfaces."
2018,"paper203","Abstract","Further, we suggest that technology should not try and replace human assistance, but instead enable people with VI to better identify and interact with other people in-situ."
2018,"paper185","Abstract","Our evaluation study shows this hybrid technique to be easy to use in situ and effective in transcending the creative potential of either traditional sketching or drawing in air."
2012,"p1549","Abstract","Our initial evaluation shows that across a corpus of dozens of tasks and thousands of requests, LemonAid retrieved a result for 90% of help requests based on UI selections and, of those, over half had relevant matches in the top 2 results."
